<?xml version="1.0" encoding="utf-8" standalone="no"?>
<rankingList xmlns:xsi="http://www.w3.org/2001/XMLSchema-instance"
			  xsi:noNamespaceSchemaLocation="TeamRanking.xsd">
	<ranking>
		<id>
			0
		</id>
		<year>
			2013
		</year>
		<rank>
			1
		</rank>
		<matchDetails>
			<date>
				2013-04-01
			</date>
			<team>
				Arizona
			</team>
			<opp>
				Colorado
			</opp>
		</matchDetails>
		<match>
			<gameNumber>
				1
			</gameNumber>
			<home_away>
				home
			</home_away>
			<win_or_lose>
				W
			</win_or_lose>
		</match>
	</ranking>
</rankingList>